<?xml version="1.0"?>
<!DOCTYPE Report
[
<!ELEMENT Report (General ,(Doc|BPT)) >
<!ATTLIST Report ver CDATA #REQUIRED tmZone CDATA #REQUIRED>

<!ELEMENT General ( DocLocation ) >
<!ATTLIST General productName CDATA #REQUIRED productVer CDATA #REQUIRED os CDATA #REQUIRED host CDATA #REQUIRED qcserver CDATA #IMPLIED qcproject CDATA #IMPLIED SolManSolutionId CDATA #IMPLIED SolManProjectId CDATA #IMPLIED SolManTestPlanId CDATA #IMPLIED SolManTestPackageId CDATA #IMPLIED SolManUserInfoData CDATA #IMPLIED  >

<!ELEMENT BPT (DName,Res,DVer?,TSet?,TInst?,NodeArgs,AdditionalInfo*,Doc*) >
<!ATTLIST BPT rID ID #REQUIRED >

<!ELEMENT Doc (DName,ConfName?,Res,DVer?,TSet?,TInst?,RunType?,DT?,AdditionalInfo*,Step*,DIter*,Step*,Action*,Doc*,Summary?,TestMaintenanceSummary*,NodeArgs?) >
<!ATTLIST Doc rID ID #REQUIRED type (Test|BC|BPTWrapperTest|Flow|Group|Action) "Test" productName CDATA #REQUIRED BCIter CDATA #IMPLIED >

<!ELEMENT RunType ( #PCDATA )>
<!ATTLIST RunType fmStep (False|True) "False" batch (False|True) "False" upDesc (False|True) "False" upChk (False|True) "False" upAS (False|True) "False">

<!ELEMENT DName ( #PCDATA ) >

<!ELEMENT ConfName ( #PCDATA ) >

<!ELEMENT Res ( #PCDATA ) >

<!ELEMENT AdditionalInfo (AdditionalDataName,AdditionalDataValue ) >

<!ELEMENT AdditionalDataName ( #PCDATA ) >

<!ELEMENT AdditionalDataValue ( #PCDATA ) >

<!ELEMENT DVer ( #PCDATA ) >

<!ELEMENT TSet ( #PCDATA ) >

<!ELEMENT TInst ( #PCDATA ) >

<!ELEMENT DIter (Step*,Action+,Summary?,NodeArgs)>
<!ATTLIST DIter rID ID #REQUIRED iterID CDATA #REQUIRED>

<!ELEMENT DocLocation ( #PCDATA )>

<!ELEMENT Action (AName,AIter*,(Step|HtmlStep|Action)*, Summary,ActionMaintenanceSummary*, NodeArgs ) >
<!ATTLIST Action rID ID #REQUIRED>

<!ELEMENT AIter ((Step|HtmlStep|Action)*,DataMapping?, Summary?,NodeArgs) >
<!ATTLIST AIter rID ID #REQUIRED iterID CDATA #REQUIRED isCountable (False|True) "False" >

<!ELEMENT AName ( #PCDATA ) >

<!ELEMENT TestMaintenanceSummary (ActionMaintenanceSummary*) >
<!ATTLIST TestMaintenanceSummary ObjectsAdded CDATA #REQUIRED ObjectsUpdated CDATA #REQUIRED StepsUpdated CDATA #REQUIRED StepsComments CDATA #REQUIRED><!ELEMENT ActionMaintenanceSummary (ObjectChange* ) >
<!ATTLIST ActionMaintenanceSummary Action CDATA #REQUIRED Objects CDATA #REQUIRED Updated CDATA #REQUIRED LinesTotal CDATA #REQUIRED Added CDATA #REQUIRED LinesUpdated CDATA #REQUIRED>

<!ELEMENT ObjectChange  (Hierarchy, PropertyChangeList* ) >
<!ATTLIST ObjectChange Operation CDATA #IMPLIED OriginalRepository CDATA #IMPLIED>

<!ELEMENT PropertyChangeList (PropertyDef*) >

<!ELEMENT PropertyDef (OriginalValue, NewValue) >
<!ATTLIST PropertyDef PropName CDATA #REQUIRED OriginRegularExpression (True|False) "False" NewRegularExpression (True|False) "False" AddedProperty (True|False) "False" >

<!ELEMENT OriginalValue ( #PCDATA )>

<!ELEMENT NewValue ( #PCDATA )>

<!ELEMENT Hierarchy  (ObjectName, Hierarchy*) >
<!ATTLIST Hierarchy MicClass CDATA #REQUIRED>

<!ELEMENT ObjectName  ( #PCDATA ) >

<!ELEMENT Step (Obj,Details,Time,TimeTick* ,(Step|HtmlStep|Doc)*, DataMapping?, NodeArgs) >
<!ATTLIST Step rID ID #REQUIRED retval CDATA #IMPLIED>

<!ELEMENT HtmlStep (HTML,TimeTick*,(Step|HtmlStep|Doc)*,NodeArgs) >
<!ATTLIST HtmlStep rID ID #REQUIRED >

<!ELEMENT Obj ( #PCDATA ) >
<!ATTLIST Obj plainTxt (False|True) "True">

<!ELEMENT Details ( #PCDATA ) >
<!ATTLIST Details plainTxt (False|True) "True">

<!ELEMENT Time ( #PCDATA ) >

<!ELEMENT HTML ( #PCDATA ) >

<!ELEMENT Disp ( #PCDATA ) >

<!ELEMENT TimeTick ( #PCDATA ) >

<!ELEMENT DataMapping ( DataMappedItem* )>
<!ELEMENT DataMappedItem EMPTY >
<!ATTLIST DataMappedItem dsName CDATA #REQUIRED >
<!ATTLIST DataMappedItem rowId CDATA #REQUIRED >

<!ELEMENT NodeArgs (Disp,TopPane?,BtmPane?,ExtendedInfo? )>
<!ATTLIST NodeArgs eType CDATA #REQUIRED icon CDATA #REQUIRED nRep CDATA #REQUIRED UserNote CDATA #IMPLIED filter (False|True) "True">
<!ATTLIST NodeArgs status (Passed|Failed|Done|Warning|Information) "Done">
<!ATTLIST NodeArgs iconSel CDATA #IMPLIED nType CDATA #IMPLIED MovieMarker CDATA "">
<!ATTLIST NodeArgs Source CDATA #IMPLIED SourceLine CDATA #IMPLIED StepFlowItemKey CDATA #IMPLIED >

<!ELEMENT TopPane (Path)>

<!ELEMENT BtmPane ( (Path|WR)?,ASHilite?)>
<!ATTLIST BtmPane vType CDATA "HTML">

<!ELEMENT Path ( #PCDATA ) >

<!ELEMENT ASHilite ( #PCDATA ) >

<!ELEMENT WR ( #PCDATA ) >

<!ELEMENT ExtendedInfo ( StepData ) >

<!ATTLIST ExtendedInfo StepType CDATA #REQUIRED>
<!ELEMENT DT (NodeArgs) >
<!ATTLIST DT rID ID #REQUIRED>

<!ELEMENT Summary (Param*)>
<!ATTLIST Summary sTime CDATA #IMPLIED eTime CDATA #IMPLIED passed CDATA #IMPLIED failed CDATA #IMPLIED warnings CDATA #IMPLIED retval CDATA #IMPLIED stopped (False|True) "False" >

<!ELEMENT Param (ParamName,ParamVal)+ >
<!ATTLIST Param paramInOut (In|Out) "In">

<!ELEMENT ParamName ( #PCDATA ) >

<!ELEMENT ParamVal ( #PCDATA ) >

]
>
<Report ver="2.0" tmZone="India Standard Time">
<General productName="Micro Focus Unified Functional Testing" productVer="14.50" os="" host="LIN59018328"><DocLocation><![CDATA[C:\Users\SHCHATTI\Documents\Unified Functional Testing\Orange_demo1]]></DocLocation></General>
<Doc rID="T1"   productName= "Micro Focus Unified Functional Testing"  >
<DName><![CDATA[Orange_demo1]]></DName>
<Res><![CDATA[Res4]]></Res>
<DT rID="T2">
<NodeArgs eType="Table" icon="2" nRep="4" filter="False" >
<Disp><![CDATA[Run-Time Data Table]]></Disp>
<BtmPane vType="Table" >
<Path><![CDATA[Default.xls]]></Path>
</BtmPane>
</NodeArgs>
</DT>
<DIter rID="T3" iterID="1" >
<Action rID="T4">
<AName><![CDATA[Login]]></AName>
<Step rID="T5">
<Obj plainTxt="False" ><![CDATA[OrangeHRM]]></Obj>
<Details plainTxt="False" ><![CDATA[<table><tr><td><span style="text-align : left; font-size : 12px; ">Local Browser</span></td></tr></table>]]></Details>
<Time><![CDATA[10-02-2023 - 15:22:08]]></Time>
<TimeTick>1676022728</TimeTick>
<Step rID="T6">
<Obj plainTxt="False" ><![CDATA[OrangeHRM]]></Obj>
<Details plainTxt="False" ><![CDATA[Page]]></Details>
<Time><![CDATA[10-02-2023 - 15:22:08]]></Time>
<TimeTick>1676022728</TimeTick>
<Step rID="T7">
<Obj plainTxt="False" ><![CDATA[username.Set]]></Obj>
<Details plainTxt="False" ><![CDATA["Admin"]]></Details>
<Time><![CDATA[10-02-2023 - 15:22:08]]></Time>
<TimeTick>1676022728</TimeTick>
<NodeArgs eType="Replay" icon="7" nRep="13" Source="Login" SourceLine="1" >
<Disp><![CDATA[username.Set]]></Disp>
</NodeArgs>
</Step>
<Step rID="T8">
<Obj plainTxt="False" ><![CDATA[password.Set]]></Obj>
<Details plainTxt="False" ><![CDATA["63e612ffd75e05c42471d920239f224251cb92a48591"]]></Details>
<Time><![CDATA[10-02-2023 - 15:22:09]]></Time>
<TimeTick>1676022729</TimeTick>
<NodeArgs eType="Replay" icon="7" nRep="16" Source="Login" SourceLine="2" >
<Disp><![CDATA[password.Set]]></Disp>
</NodeArgs>
</Step>
<Step rID="T9">
<Obj plainTxt="False" ><![CDATA[Login.Click]]></Obj>
<Details plainTxt="False" ><![CDATA[]]></Details>
<Time><![CDATA[10-02-2023 - 15:22:09]]></Time>
<TimeTick>1676022729</TimeTick>
<NodeArgs eType="Replay" icon="8" nRep="19" Source="Login" SourceLine="3" >
<Disp><![CDATA[Login.Click]]></Disp>
</NodeArgs>
</Step>
<NodeArgs eType="Context" icon="6" nRep="12" Source="Login" SourceLine="1" >
<Disp><![CDATA[OrangeHRM]]></Disp>
</NodeArgs>
</Step>
<NodeArgs eType="Context" icon="5" nRep="11" Source="Login" SourceLine="1" >
<Disp><![CDATA[OrangeHRM]]></Disp>
</NodeArgs>
</Step>
<Summary sTime="10-02-2023 - 15:22:07" eTime="10-02-2023 - 15:22:09" passed="0" failed="0" warnings="0" ></Summary>
<NodeArgs eType="StartAction" icon="4" nRep="7" >
<Disp><![CDATA[Login Summary]]></Disp>
</NodeArgs>
</Action>
<Action rID="T10">
<AName><![CDATA[search]]></AName>
<Step rID="T11">
<Obj plainTxt="False" ><![CDATA[OrangeHRM]]></Obj>
<Details plainTxt="False" ><![CDATA[<table><tr><td><span style="text-align : left; font-size : 12px; ">Local Browser</span></td></tr></table>]]></Details>
<Time><![CDATA[10-02-2023 - 15:22:11]]></Time>
<TimeTick>1676022731</TimeTick>
<Step rID="T12">
<Obj plainTxt="False" ><![CDATA[OrangeHRM]]></Obj>
<Details plainTxt="False" ><![CDATA[Page]]></Details>
<Time><![CDATA[10-02-2023 - 15:22:11]]></Time>
<TimeTick>1676022731</TimeTick>
<Step rID="T13">
<Obj plainTxt="False" ><![CDATA[Search.Set]]></Obj>
<Details plainTxt="False" ><![CDATA["pIM"]]></Details>
<Time><![CDATA[10-02-2023 - 15:22:11]]></Time>
<TimeTick>1676022731</TimeTick>
<NodeArgs eType="Replay" icon="7" nRep="27" Source="search" SourceLine="0" >
<Disp><![CDATA[Search.Set]]></Disp>
</NodeArgs>
</Step>
<Step rID="T14">
<Obj plainTxt="False" ><![CDATA[PIM.Click]]></Obj>
<Details plainTxt="False" ><![CDATA[]]></Details>
<Time><![CDATA[10-02-2023 - 15:22:11]]></Time>
<TimeTick>1676022731</TimeTick>
<NodeArgs eType="Replay" icon="9" nRep="30" Source="search" SourceLine="1" >
<Disp><![CDATA[PIM.Click]]></Disp>
</NodeArgs>
</Step>
<NodeArgs eType="Context" icon="6" nRep="26" Source="search" SourceLine="0" >
<Disp><![CDATA[OrangeHRM]]></Disp>
</NodeArgs>
</Step>
<NodeArgs eType="Context" icon="5" nRep="25" Source="search" SourceLine="0" >
<Disp><![CDATA[OrangeHRM]]></Disp>
</NodeArgs>
</Step>
<Summary sTime="10-02-2023 - 15:22:09" eTime="10-02-2023 - 15:22:11" passed="0" failed="0" warnings="0" ></Summary>
<NodeArgs eType="StartAction" icon="4" nRep="21" >
<Disp><![CDATA[search Summary]]></Disp>
</NodeArgs>
</Action>
<Action rID="T15">
<AName><![CDATA[Add_emp]]></AName>
<Step rID="T16">
<Obj plainTxt="False" ><![CDATA[OrangeHRM]]></Obj>
<Details plainTxt="False" ><![CDATA[<table><tr><td><span style="text-align : left; font-size : 12px; ">Local Browser</span></td></tr></table>]]></Details>
<Time><![CDATA[10-02-2023 - 15:22:13]]></Time>
<TimeTick>1676022733</TimeTick>
<Step rID="T17">
<Obj plainTxt="False" ><![CDATA[OrangeHRM]]></Obj>
<Details plainTxt="False" ><![CDATA[Page]]></Details>
<Time><![CDATA[10-02-2023 - 15:22:13]]></Time>
<TimeTick>1676022733</TimeTick>
<Step rID="T18">
<Obj plainTxt="False" ><![CDATA[Add Employee.Click]]></Obj>
<Details plainTxt="False" ><![CDATA[]]></Details>
<Time><![CDATA[10-02-2023 - 15:22:13]]></Time>
<TimeTick>1676022733</TimeTick>
<NodeArgs eType="Replay" icon="10" nRep="37" Source="Add_emp" SourceLine="0" >
<Disp><![CDATA[Add Employee.Click]]></Disp>
</NodeArgs>
</Step>
<NodeArgs eType="Context" icon="6" nRep="36" Source="Add_emp" SourceLine="0" >
<Disp><![CDATA[OrangeHRM]]></Disp>
</NodeArgs>
</Step>
<Step rID="T19">
<Obj plainTxt="False" ><![CDATA[OrangeHRM_2]]></Obj>
<Details plainTxt="False" ><![CDATA[Page]]></Details>
<Time><![CDATA[10-02-2023 - 15:22:14]]></Time>
<TimeTick>1676022734</TimeTick>
<Step rID="T20">
<Obj plainTxt="False" ><![CDATA[firstName.Set]]></Obj>
<Details plainTxt="False" ><![CDATA["Prajwal"]]></Details>
<Time><![CDATA[10-02-2023 - 15:22:14]]></Time>
<TimeTick>1676022734</TimeTick>
<NodeArgs eType="Replay" icon="7" nRep="42" Source="Add_emp" SourceLine="1" >
<Disp><![CDATA[firstName.Set]]></Disp>
</NodeArgs>
</Step>
<Step rID="T21">
<Obj plainTxt="False" ><![CDATA[middleName.Set]]></Obj>
<Details plainTxt="False" ><![CDATA["s"]]></Details>
<Time><![CDATA[10-02-2023 - 15:22:14]]></Time>
<TimeTick>1676022734</TimeTick>
<NodeArgs eType="Replay" icon="7" nRep="45" Source="Add_emp" SourceLine="2" >
<Disp><![CDATA[middleName.Set]]></Disp>
</NodeArgs>
</Step>
<Step rID="T22">
<Obj plainTxt="False" ><![CDATA[lastName.Set]]></Obj>
<Details plainTxt="False" ><![CDATA["c"]]></Details>
<Time><![CDATA[10-02-2023 - 15:22:14]]></Time>
<TimeTick>1676022734</TimeTick>
<NodeArgs eType="Replay" icon="7" nRep="48" Source="Add_emp" SourceLine="3" >
<Disp><![CDATA[lastName.Set]]></Disp>
</NodeArgs>
</Step>
<Step rID="T23">
<Obj plainTxt="False" ><![CDATA[WebEdit.Set]]></Obj>
<Details plainTxt="False" ><![CDATA["0666"]]></Details>
<Time><![CDATA[10-02-2023 - 15:22:15]]></Time>
<TimeTick>1676022735</TimeTick>
<NodeArgs eType="Replay" icon="7" nRep="51" Source="Add_emp" SourceLine="4" >
<Disp><![CDATA[WebEdit.Set]]></Disp>
</NodeArgs>
</Step>
<Step rID="T24">
<Obj plainTxt="False" ><![CDATA[Save.Click]]></Obj>
<Details plainTxt="False" ><![CDATA[]]></Details>
<Time><![CDATA[10-02-2023 - 15:22:15]]></Time>
<TimeTick>1676022735</TimeTick>
<NodeArgs eType="Replay" icon="8" nRep="54" Source="Add_emp" SourceLine="5" >
<Disp><![CDATA[Save.Click]]></Disp>
</NodeArgs>
</Step>
<NodeArgs eType="Context" icon="6" nRep="41" Source="Add_emp" SourceLine="1" >
<Disp><![CDATA[OrangeHRM_2]]></Disp>
</NodeArgs>
</Step>
<Step rID="T25">
<Obj plainTxt="False" ><![CDATA[OrangeHRM_3]]></Obj>
<Details plainTxt="False" ><![CDATA[Page]]></Details>
<Time><![CDATA[10-02-2023 - 15:22:15]]></Time>
<TimeTick>1676022735</TimeTick>
<Step rID="T26">
<Obj plainTxt="False" ><![CDATA[WebEdit.Set]]></Obj>
<Details plainTxt="False" ><![CDATA["prajju"]]></Details>
<Time><![CDATA[10-02-2023 - 15:22:15]]></Time>
<TimeTick>1676022735</TimeTick>
<NodeArgs eType="Replay" icon="7" nRep="58" Source="Add_emp" SourceLine="6" >
<Disp><![CDATA[WebEdit.Set]]></Disp>
</NodeArgs>
</Step>
<Step rID="T27">
<Obj plainTxt="False" ><![CDATA[WebEdit_2.Set]]></Obj>
<Details plainTxt="False" ><![CDATA["abc123"]]></Details>
<Time><![CDATA[10-02-2023 - 15:22:15]]></Time>
<TimeTick>1676022735</TimeTick>
<NodeArgs eType="Replay" icon="7" nRep="61" Source="Add_emp" SourceLine="7" >
<Disp><![CDATA[WebEdit_2.Set]]></Disp>
</NodeArgs>
</Step>
<Step rID="T28">
<Obj plainTxt="False" ><![CDATA[WebElement.Click]]></Obj>
<Details plainTxt="False" ><![CDATA[]]></Details>
<Time><![CDATA[10-02-2023 - 15:22:15]]></Time>
<TimeTick>1676022735</TimeTick>
<NodeArgs eType="Replay" icon="10" nRep="64" Source="Add_emp" SourceLine="8" >
<Disp><![CDATA[WebElement.Click]]></Disp>
</NodeArgs>
</Step>
<Step rID="T29">
<Obj plainTxt="False" ><![CDATA[2023]]></Obj>
<Details plainTxt="False" ><![CDATA[Cannot&nbsp;identify&nbsp;the&nbsp;object&nbsp;"2023"&nbsp;(of&nbsp;class&nbsp;WebElement).<br/>Verify&nbsp;that&nbsp;this&nbsp;object's&nbsp;properties&nbsp;match&nbsp;an&nbsp;object&nbsp;currently&nbsp;displayed&nbsp;in&nbsp;your&nbsp;application.]]></Details>
<Time><![CDATA[10-02-2023 - 15:22:36]]></Time>
<TimeTick>1676022756</TimeTick>
<Step rID="T30">
<Obj plainTxt="False" ><![CDATA[2023]]></Obj>
<Details plainTxt="False" ><![CDATA[Object's physical description:<br>Mercury Class = WebElement<br>Html Tag = P<br>_xpath = //DIV/DIV/DIV/DIV/DIV/DIV/DIV/DIV/UL/LI/DIV/P[normalize-space()="2023"]<br>|Visible = -1<br>innertext = 2023<br>Html Id = <br>DHTML Class = oxd-text oxd-text--p<br>acc_name = <br>]]></Details>
<Time><![CDATA[10-02-2023 - 15:22:36]]></Time>
<TimeTick>1676022756</TimeTick>
<NodeArgs eType="Replay" icon="11" nRep="109" status="Warning" nType="Description" Source="Add_emp" SourceLine="9" >
<Disp><![CDATA[2023]]></Disp>
</NodeArgs>
</Step>
<NodeArgs eType="Replay" icon="10" nRep="108" status="Failed" nType="Run Error" Source="Add_emp" SourceLine="9" >
<Disp><![CDATA[2023]]></Disp>
</NodeArgs>
</Step>
<NodeArgs eType="Context" icon="6" nRep="57" status="Failed" Source="Add_emp" SourceLine="6" >
<Disp><![CDATA[OrangeHRM_3]]></Disp>
</NodeArgs>
</Step>
<NodeArgs eType="Context" icon="5" nRep="35" status="Failed" Source="Add_emp" SourceLine="0" >
<Disp><![CDATA[OrangeHRM]]></Disp>
</NodeArgs>
</Step>
<Step rID="T31">
<Obj plainTxt="False" ><![CDATA[OrangeHRM]]></Obj>
<Details plainTxt="False" ><![CDATA[<table><tr><td><span style="text-align : left; font-size : 12px; ">Local Browser</span></td></tr></table>]]></Details>
<Time><![CDATA[10-02-2023 - 15:22:36]]></Time>
<TimeTick>1676022756</TimeTick>
<Step rID="T32">
<Obj plainTxt="False" ><![CDATA[Run Error]]></Obj>
<Details plainTxt="False" ><![CDATA[Cannot identify the object &quot;2023&quot; (of class WebElement).<BR/>Verify that this object's properties match an object currently displayed in your application.<BR/>Line (10): &quot;Browser(&quot;OrangeHRM&quot;).Page(&quot;OrangeHRM_3&quot;).WebElement(&quot;2023&quot;).Click&quot;. ]]></Details>
<Time><![CDATA[10-02-2023 - 15:22:36]]></Time>
<TimeTick>1676022756</TimeTick>
<NodeArgs eType="Replay" icon="11" nRep="111" status="Failed" Source="Add_emp" SourceLine="9" >
<Disp><![CDATA[Run Error]]></Disp>
<BtmPane vType="ViewerGen.SSViewerGen" >
<Path><![CDATA[ZIP::Act3\Row0\ssf2.xml]]></Path>
<ASHilite><![CDATA[3213642]]></ASHilite>
</BtmPane>
</NodeArgs>
</Step>
<Step rID="T33">
<Obj plainTxt="False" ><![CDATA[Stop Run]]></Obj>
<Details plainTxt="False" ><![CDATA[Run stopped by user.]]></Details>
<Time><![CDATA[10-02-2023 - 15:22:56]]></Time>
<TimeTick>1676022776</TimeTick>
<NodeArgs eType="General" icon="12" nRep="112" status="Information" >
<Disp><![CDATA[Stop Run]]></Disp>
</NodeArgs>
</Step>
<NodeArgs eType="Context" icon="5" nRep="110" status="Failed" Source="Add_emp" SourceLine="9" >
<Disp><![CDATA[OrangeHRM]]></Disp>
<BtmPane vType="ViewerGen.SSViewerGen" >
<Path><![CDATA[ZIP::Act3\Row0\ssf1.xml]]></Path>
<ASHilite><![CDATA[3213642]]></ASHilite>
</BtmPane>
</NodeArgs>
</Step>
<Summary sTime="10-02-2023 - 15:22:11" eTime="10-02-2023 - 15:22:56" passed="0" failed="2" warnings="1" ></Summary>
<NodeArgs eType="StartAction" icon="4" nRep="32" status="Failed" >
<Disp><![CDATA[Add_emp Summary]]></Disp>
</NodeArgs>
</Action>
<NodeArgs eType="StartIteration" icon="3" nRep="6" status="Failed" >
<Disp><![CDATA[Orange_demo1 Iteration 1 (Row 1)]]></Disp>
</NodeArgs>
</DIter>
<Summary sTime="10-02-2023 - 15:22:06" eTime="10-02-2023 - 15:22:56" passed="0" failed="2" warnings="1" ></Summary>
<NodeArgs eType="StartTest" icon="1" nRep="3" status="Failed" >
<Disp><![CDATA[Test Orange_demo1 Summary]]></Disp>
</NodeArgs>
</Doc>
</Report>